Title,Content
Aider les développeurs à créer des API sécurisées dès le départ,"[{'', '<p>Les entreprises modernes gèrent des dizaines de milliers d’API. Si cette interconnexion favorise l’innovation et l’agilité, elle crée également une surface d’attaque coûteuse et tentaculaire. Rien qu’en 2022, on estime que les entreprises américaines ont perdu jusqu’à 23 milliards de dollars à cause de compromissions liées aux API, et 59 % des organisations ont été contraintes de ralentir le déploiement de nouvelles applications en production en raison de problèmes de sécurité des API.</p>'}, {'', ""<p>Bien que les développeurs soient en grande partie responsables de la création et de la gestion des API au sein d'une organisation, ils ont rarement accès aux outils réseau nécessaires pour les sécuriser ou les contrôler. Pour minimiser les risques liés aux API, les développeurs doivent avoir la possibilité de les créer en toute sécurité dès le départ. Voici les mesures et outils de sécurité nécessaires pour obtenir les meilleurs résultats.</p>""}, {'', '<h3>Bonnes pratiques en matière de sécurité des API</h3>'}, {'', '<p>Les API sont conçues pour aider les applications à communiquer entre elles. Elles ont donc souvent accès aux données de l’entreprise et des clients, notamment aux informations financières et aux enregistrements de transactions. Ce n’est pas un secret, et c’est pourquoi les pirates informatiques ciblent souvent les API, en particulier celles exposées aux requêtes réseau. Pour atténuer ce risque, les développeurs doivent mettre en œuvre les meilleures pratiques de sécurité dans chaque API qu’ils créent, notamment en ajoutant l’authentification et l’autorisation, les contrôles d’accès et le chiffrement pour toutes les requêtes et réponses d’API.</p>'}, {'', '<h3>Authentification et autorisation</h3>'}, {'', '<p>Une sécurité API efficace repose sur l’authentification (qui sont les utilisateurs) et l’autorisation (ce que les utilisateurs peuvent faire) pour contrôler l’accès aux ressources. Les applications côté client doivent inclure un jeton dans l’appel d’API, permettant au service de valider l’identité du client via l’authentification à l’aide d’une norme comme OAuth 2.0, OpenID Connect ou JSON Web Tokens. Ensuite, l’autorisation doit déterminer les actions autorisées pour le client authentifié. Cela garantit que les utilisateurs ou les appareils ne disposent que des autorisations minimales requises pour effectuer des tâches spécifiques, conformément au principe du moindre privilège.</p>'}, {'', ""<h3>Contrôles d'accès</h3>""}, {'', ""<p>Toute API qui accorde un accès tiers aux systèmes et données internes doit inclure des contrôles d'accès et une surveillance robustes. Les développeurs peuvent mettre en œuvre ces contrôles via un middleware pour vérifier l'identité de l'utilisateur, déterminer les actions autorisées et définir quand ces actions sont autorisées et pendant combien de temps. Le middleware peut également limiter le débit et appliquer des politiques de sécurité telles que le géorepérage, la validation du contenu des E/S et la désinfection des données. Pour une protection avancée, les développeurs doivent placer les API derrière une passerelle API, un pare-feu ou un pare-feu d'application Web utilisant HTTPS pour crypter la communication et filtrer le trafic malveillant.</p>""}, {'', '<h3>Cryptage</h3>'}, {'', ""<p>Le chiffrement des requêtes et des réponses API peut contribuer à protéger contre les écoutes clandestines et les violations de données. Les développeurs doivent utiliser HTTPS comme protocole de communication pour chiffrer tout le trafic et protéger les informations sensibles telles que les informations d'identification et les données échangées entre l'API et ses clients. Ils peuvent activer HTTP Strict Transport Security (HSTS) au lieu de rediriger pour garantir que les clients API utilisent toujours HTTPS, évitant ainsi les fuites d'informations accidentelles dues à des connexions non sécurisées. En intégrant le chiffrement au cœur de l'API, les développeurs peuvent garantir que les données sensibles restent protégées pendant la communication.</p>""}, {'', ""<h3>Amélioration de la sécurité des API grâce à l'accès des développeurs aux outils de mise en réseau</h3>""}, {'', '<p>Ces bonnes pratiques peuvent réduire considérablement le risque de failles de sécurité des API, mais de nombreux développeurs n’ont pas directement accès aux outils nécessaires pour les mettre en œuvre. Les passerelles API, qui sont utilisées pour gérer le trafic API, présentent un risque car les développeurs n’ont aucun contrôle sur elles. Cela augmente la probabilité d’une rupture de contrat entre les services API et la gestion du trafic, ce qui peut entraîner des temps d’arrêt et une sécurité affaiblie en raison de mauvaises configurations.</p>'}, {'', ""<p>Les passerelles API définies par les développeurs peuvent éliminer ces frictions et rationaliser le processus de déploiement. Elles permettent aux développeurs d'établir une connectivité sécurisée à leurs API en y intégrant directement les entrées. La déclaration des entrées, qui englobent des fonctionnalités telles que les hautes performances, la résilience, la sécurité et l'observabilité, directement dans l'application peut simplifier le processus de développement et réduire les incidents de sécurité et de performances. Les développeurs peuvent s'assurer que les requêtes API contiennent les paramètres exacts attendus par l'API pour éliminer le risque de rupture de contrat, d'accès non autorisé, etc.</p>""}, {'', '<p>En donnant aux développeurs l’accès à des outils de gestion du trafic robustes tels que les passerelles API, ils peuvent créer des API sécurisées dès le départ. En combinant cette fonctionnalité avec l’authentification et l’autorisation, les contrôles d’accès et le chiffrement, on peut réduire considérablement les cas de compromission liés aux API, tout en améliorant les délais de mise sur le marché et les performances. Les développeurs sont déjà chargés de créer et de gérer les API ; ils doivent également être en mesure de les sécuriser facilement.</p>'}]"
Boomi centralise la gestion et la gouvernance des API,"[{'', ""<p>Boomi a lancé cette semaine un plan de contrôle pour les interfaces de programmation d'applications (API) pour permettre aux organisations de les gérer et de les gouverner de manière centralisée, quelle que soit la manière dont elles sont créées ou la plate-forme sur laquelle elles s'exécutent.</p>""}, {'', ""<p>Jamie Ryan, vice-président de la gestion des produits chez Boomi, a déclaré que Boomi API Control Plane permet aux équipes informatiques de découvrir des API, y compris des API fantômes et malveillantes qui étaient jusque-là inconnues. C'est essentiel car le nombre d'API non gérées dans la plupart des organisations dépasse encore largement le nombre d'API gérées, a-t-il ajouté.</p>""}, {'', ""<p>Basé sur une plateforme que Boomi a acquise auprès d'APIIDA plus tôt cette année, l'objectif global est, via un ensemble d'agents de passerelle, de fournir la possibilité de découvrir des API, puis de centraliser la gestion sans obliger les organisations à migrer loin de toute plateforme sur laquelle elles ont déjà été déployées, a déclaré Ryan.</p>""}, {'', ""<p>Cette approche fédérée permettra aux équipes informatiques de gérer plus facilement la prolifération des API à une époque où elles sont créées plus rapidement que jamais, a-t-il ajouté. À mesure que les environnements applicatifs deviennent plus distribués, il devient de moins en moins probable que les entreprises souhaitent se standardiser sur une plateforme de gestion des API optimisée pour un environnement informatique spécifique lorsqu'il existe un plan de contrôle qui s'intègre à tous, a noté Ryan.</p>""}, {''}, {'', ""<p>Cela permet également aux équipes informatiques de mieux comprendre la manière dont les API sont utilisées, a noté Ryan. Il a ajouté qu'un trop grand nombre d'API ont été créées sans être utilisées aux fins prévues. À moins que ces API ne soient retirées, elles créent une autre surface d'attaque que les cybercriminels sont de plus en plus aptes à exploiter, a déclaré Ryan.</p>""}, {'', '<p>Les personnes chargées de gérer les API au sein d’une organisation informatique varient considérablement. Dans certains cas, ce sont les développeurs qui gèrent les API. Dans d’autres cas, cette responsabilité incombe à une équipe DevOps ou à une équipe d’ingénierie de plateforme. Une équipe de gestion de produits peut également être chargée de gérer les API. Le plan de contrôle des API Boomi fournit aux équipes un tableau de bord unique grâce auquel chaque membre de l’équipe peut participer à la gestion du portefeuille d’API de l’organisation, a noté Ryan.</p>'}, {'', '<p>Cela est particulièrement crucial à mesure que de plus en plus de modèles et de plateformes d’intelligence artificielle (IA) qui exposent des API supplémentaires s’intègrent aux environnements informatiques existants, a-t-il ajouté.</p>'}, {'', '<p>Quelle que soit la personne responsable au sein d’une organisation, la gestion du cycle de vie des API reste un défi. De nombreux développeurs, par exemple, créent des API pour une application interne et découvrent que cette API est désormais accessible par des applications externes. Le problème est que le niveau de contrôle de sécurité d’une API interne n’est pas toujours le même que celui d’une API externe. Sans que personne ne s’en rende compte, une API interne peut soudainement devenir accessible aux cybercriminels qui sont récemment devenus de plus en plus habiles à les utiliser pour exfiltrer des données et manipuler la logique métier à leurs propres fins néfastes. Boomi résout ce problème en permettant aux organisations d’évaluer les contrôles de sécurité relatifs appliqués à leurs API.</p>'}, {'', '<p>On ne sait pas encore dans quelle mesure la gestion des API et les outils nécessaires pour les sécuriser convergent, mais en général, les équipes informatiques s’orientent vers une centralisation de la gestion des opérations informatiques et de sécurité. La question est désormais de déterminer la meilleure façon d’atteindre cet objectif en incluant les API.</p>'}]"
Pourquoi vous risquez de supprimer des données mobiles clés de votre solution d'observabilité,"[{'', '<p>D</p>'}]"
Les trois piliers de la gestion moderne des API,"[{'', '<p>La prolifération des API est un véritable problème pour les entreprises modernes. Les entreprises gèrent des dizaines de milliers d’API dans leurs applications et services. Au-dessus se trouvent plusieurs passerelles d’API telles qu’Amazon API Gateway ou Google Apigee, ainsi que des courtiers d’événements tels que Solace, qui sont limités dans leur capacité à voir les autres passerelles. Il doit y avoir un endroit central où toutes les API sont sécurisées, détectables et gouvernables, quel que soit leur emplacement ou la passerelle d’API utilisée. Nous avons vu des tendances autour de la création d’un « panneau de verre unique » dans d’autres domaines du développement moderne (l’observabilité étant une catégorie qui me vient à l’esprit), mais la gestion des API reste un désordre complexe et cloisonné. Cela a des implications importantes pour la gouvernance des API.</p>'}, {'', ""<p>C'est là qu'entre en jeu la gestion des API fédérées.</p>""}, {'', '<p>Contrairement à l’approche plus traditionnelle, où la plupart des fonctionnalités de gestion des API étaient inextricablement liées à la passerelle API spécifique utilisée, la gestion fédérée des API soustrait une grande partie de la gestion et de la gouvernance de vos API à la passerelle API. Pour être clair, la passerelle API reste un composant crucial de l’infrastructure, mais les équipes doivent être habilitées à utiliser la passerelle API la mieux adaptée à leur cas d’utilisation tout en étant en mesure d’obtenir une gouvernance appropriée.</p>'}, {'', ""<p>Cette approche fédérée permet aux équipes de plateforme centrale de gérer chaque API sans avoir à basculer entre différents outils. Il s'agit d'une couche de gestion qui repose sur les passerelles sous-jacentes en tant que « wrapper » de gouvernance. Les équipes de plateforme doivent pouvoir tout faire, de la découverte et de l'inventaire des API à la mesure de la conformité des spécifications, en passant par la conception des flux d'abonnement et la publication des API sur un portail de développement pour la découverte et la consommation en libre-service côté consommateur, le tout avec une seule plateforme.</p>""}, {'', '<p>Et cela ne peut pas se limiter aux API synchrones. La gestion des API doit commencer à traiter les flux d’événements et les API d’événements comme des citoyens de première classe, au même titre que les API synchrones, à mesure que de plus en plus d’organisations introduisent et/ou redynamisent les initiatives de diffusion d’événements. Cela permettra aux équipes d’obtenir un meilleur retour sur investissement de leur investissement initial dans le streaming. Et bien sûr, tout système de gestion d’API moderne que vous envisagez doit être axé sur l’IA pour rester en phase avec les normes du secteur.</p>'}, {'', '<p>Pour être concis, voici les trois piliers que toute solution de gestion d’API doit couvrir.</p>'}, {'', '<h3>Les trois piliers</h3>'}, {'', ""<p>Multi-passerelle et multi-courtier\xa0: la gestion des API, en tant que pratique, doit prendre en charge la capacité des éditeurs d'API à gérer, sécuriser et gouverner les API et les services à partir de plusieurs passerelles d'API et courtiers d'événements différents.</p>""}, {'', ""<p>Événement natif\xa0: la gestion des API doit traiter les flux d'événements et les API d'événements comme des éléments de premier ordre, au même titre que les API synchrones, car de plus en plus d'organisations introduisent le streaming d'événements. Cela permettra aux équipes d'obtenir un meilleur retour sur investissement de leur investissement initial dans le streaming.</p>""}, {'', '<p>AI-Forward\xa0: les fournisseurs de gestion d’API doivent trouver des moyens d’améliorer leurs offres de gestion d’API grâce à l’IA et de mieux permettre aux organisations d’exploiter l’IA comme un multiplicateur de force.</p>'}, {'', '<p>Si la solution de gestion des API de votre entreprise est multi-passerelle, native des événements et axée sur l’IA, vous aurez une longueur d’avance sur la concurrence en termes de productivité et de sécurité. À l’heure actuelle, où des milliers d’API sont exploitées dans toute une organisation, il est évident de disposer d’une source unique de vérité où ces API sont détectables et gérées de manière adéquate. En bénéficiant d’une plus grande transparence et d’une meilleure visibilité, les développeurs peuvent évoluer plus rapidement tandis que les équipes de plateforme et de sécurité peuvent se sentir plus confiantes quant à leur posture de sécurité. C’est gagnant-gagnant.</p>'}]"
Une enquête révèle de nombreuses failles dans la chaîne d'approvisionnement des logiciels,"[{'', ""<p>Une enquête mondiale menée auprès de 900 professionnels de la sécurité des applications révèle que près des deux tiers d'entre eux travaillent pour des organisations dont la chaîne d'approvisionnement en logiciels a été compromise au cours des deux dernières années, 18 % d'entre eux ayant été victimes de cette situation au cours de l'année écoulée.</p>""}, {'', ""<p>Menée par Checkmarx, un fournisseur d'outils de test de sécurité des applications, l'enquête révèle également que 100 % des personnes interrogées ont connaissance d'une violation de leur chaîne d'approvisionnement en logiciels survenue à un moment donné dans le passé.</p>""}, {'', '<p>Sans surprise, l’enquête révèle que les trois quarts des répondants (75 %) sont désormais soit très préoccupés (39 %), soit préoccupés (36 %) par la sécurité de leur chaîne d’approvisionnement en logiciels.</p>'}, {'', '<p>En outre, plus de la moitié (57 %) des entreprises interrogées ont déclaré que la sécurité de la chaîne d’approvisionnement en logiciels était un domaine prioritaire ou important, et 54 % d’entre elles envisageaient d’utiliser ou d’étudier un type de solution. Cependant, selon l’enquête, seuls 7 % ont acquis et mis en œuvre un outil ou une plateforme pour sécuriser spécifiquement leur chaîne d’approvisionnement en logiciels.</p>'}, {'', ""<p>Du côté positif, la moitié (50 %) des personnes interrogées demandent désormais des nomenclatures de logiciels (SBOM) aux entités qui fournissent des logiciels à leur organisation, mais moins de la moitié (47 %) ont déclaré que leur organisation pouvait mettre en œuvre efficacement les SBOM, selon l'enquête.</p>""}, {'', ""<p>Renny Shen, vice-président du marketing de portefeuille chez Checkmarx, a déclaré que le défi réside dans l'ampleur des efforts nécessaires pour sécuriser les chaînes d'approvisionnement en logiciels. En plus des SBOM et du déploiement d'outils pour découvrir les vulnérabilités et les logiciels malveillants, les équipes DevSecOps doivent également, par exemple, adopter des initiatives de confiance zéro pour sécuriser l'accès à leur chaîne d'approvisionnement en logiciels.</p>""}, {'', '<p>Il n’existe pas d’outil ou de plateforme unique permettant aux équipes DevSecOps d’atteindre cet objectif, a-t-il ajouté.</p>'}, {'', '<p>En général, la sécurisation des logiciels reste un défi car même si une vulnérabilité est découverte, une équipe DevSecOps peut ne pas être en mesure de la corriger, a noté Shen. Par exemple, plus de la moitié (56 %) des applications déployées sont basées sur des packages de code open source dont les entreprises dépendent de mainteneurs externes pour la mise à jour.</p>'}, {'', '<p>Le point positif est que la sécurité de la chaîne d’approvisionnement logicielle est devenue une question de haut niveau, a déclaré Shen. Le défi est que de nombreuses organisations n’ont pas encore défini un ensemble d’indicateurs clés de performance (KPI) qui leur permettent de s’assurer que les meilleures pratiques DevSecOps sont adoptées. À l’heure actuelle, l’accent n’est pas suffisamment mis sur la sécurité des applications, de sorte que les développeurs continueront de consacrer la majeure partie de leur temps et de leurs efforts à l’écriture de nouveau code plutôt qu’à la correction du code existant, a-t-il noté.</p>'}, {'', '<p>Malheureusement, la plupart des entreprises ne donnent pas la priorité à la sécurité des applications. Tant qu’il n’y aura pas de changement fondamental dans les motivations, il est peu probable que les développeurs consacrent plus de temps à la correction des vulnérabilités. Des efforts ont été faits pour transférer davantage de responsabilités en matière de sécurité vers les développeurs, mais le succès a été mitigé. Les développeurs ont généralement accès à davantage d’outils, mais à moins que ces outils ne fassent apparaître des problèmes au fur et à mesure que les développeurs écrivent du code, il est peu probable qu’ils aient un impact significatif sur l’amélioration de l’état général de la sécurité des applications.</p>'}, {'', '<p>Espérons que l’essor de l’intelligence artificielle générative (IA) simplifiera bientôt la recherche et la correction des vulnérabilités, par exemple en créant automatiquement le correctif requis. En attendant, toutefois, sécuriser les chaînes d’approvisionnement en logiciels exige un niveau de vigilance qui, malgré les meilleures intentions, reste difficile à atteindre et à maintenir.</p>'}]"
Fauna ajoute un outil déclaratif pour mettre à jour la base de données des homonymes,"[{'', ""<p>Fauna a ajouté la capacité de maintenir une application stricte du schéma à sa base de données relationnelle de documents à l'aide d'un langage déclaratif qui simplifie la mise à jour des bases de données dans le contexte d'un flux de travail DevOps.</p>""}, {'', ""<p>Alors que Fauna a permis aux équipes informatiques d'étendre une base de données de documents pour ajouter des tables et des lignes nécessitant généralement une base de données relationnelle, Fauna Schema ajoute la structure, l'application et la fiabilité d'un schéma généralement associé aux bases de données relationnelles traditionnelles.</p>""}, {'', ""<p>Eric Berg, PDG de Fauna, a déclaré que l'ajout de cette approche renforce l'intérêt d'utiliser une base de données Fauna qui simplifie la gestion des bases de données pouvant être utilisées pour prendre en charge plusieurs types d'applications. En outre, Fauna permet désormais aux schémas de base de données d'évoluer en fonction des besoins de l'entreprise grâce à une nouvelle fonctionnalité de types de documents qui permet aux développeurs de définir et d'appliquer des structures de schéma directement dans la base de données. Les types de documents peuvent prendre en charge le typage statique et dynamique, ce qui permet aux développeurs de commencer avec une base de données de documents sans schéma avant d'ajouter des contrôles de type plus stricts d'une manière qui ne nécessite pas la mise hors ligne d'une base de données, a déclaré Berg.</p>""}, {''}, {'', '<p>Au cœur de cette capacité se trouve le langage Fauna Schema Language (FSL), qui permet aux développeurs de définir de manière déclarative leurs modèles de domaine, leurs contrôles d’accès et leur logique métier dans un langage lisible par l’homme dans un ensemble de fichiers qui peuvent être gérés parallèlement à leur code d’application.</p>'}, {'', ""<p>Grâce à un référentiel de code tel que GitHub, les équipes DevOps peuvent désormais coordonner les mises à jour des schémas et des codes d'application via un pipeline d'intégration continue/livraison continue (CI/CD). De plus, les équipes informatiques peuvent exploiter des outils d'infrastructure en tant que code (IaC) tels que Pulumi et Terraform pour automatiser le déploiement et la gestion de leur configuration de base de données Fauna.</p>""}, {'', ""<p>Fauna a également ajouté une fonctionnalité de champs calculés qui permet de générer dynamiquement les valeurs des champs des documents en fonction des expressions définies par l'utilisateur. Cette approche permet aux développeurs de créer des champs dont les valeurs sont calculées au moment de la requête pour permettre une composition dynamique des objets et des valeurs des champs. Ces champs peuvent être indexés, ce qui offre une plus grande flexibilité dans les modèles de requête afin que les développeurs puissent définir avec précision leur modèle de données dans la base de données au lieu de les définir dans des couches de mappage exécutées en dehors de la base de données.</p>""}, {'', ""<p>Le codage de cette logique de base de données au sein de la base de données permet aux équipes de développement de définir des jointures et des sous-requêtes entre collections comme un élément de leur conception de schéma pour générer dynamiquement des données et des modèles d'objet en temps réel. Cette capacité évite les inconvénients de performances inhérents à une stratégie de dénormalisation des données requise par d'autres bases de données de documents.</p>""}, {'', '<p>On ne sait pas exactement dans quelle mesure les organisations informatiques s’orientent vers la consolidation des bases de données, mais avec l’essor des bases de données documentaires, il est devenu relativement simple pour les développeurs d’ajouter une base de données à presque n’importe quel type d’application. Le défi auquel les organisations sont confrontées est qu’à mesure que les bases de données documentaires évoluent, elles deviennent plus difficiles à gérer. Il n’est pas rare que les développeurs confient la responsabilité de la gestion des bases de données documentaires à une équipe DevOps qui a souvent un intérêt direct dans la consolidation.</p>'}, {'', '<p>Après tout, plus il y a de bases de données basées sur des architectures disparates à gérer, plus il devient difficile de gérer les flux de travail DevOps à n’importe quel niveau d’échelle significatif.</p>'}]"
