Title,Content
"Sécurité, automatisation et expérience des développeurs : les principales tendances DevOps de 2024","[{'', '<p>Si vous demandez à la plupart des gens de décrire les principales tendances DevOps en 2024, vous entendrez probablement des mots à la mode comme IA ou DevSecOps.</p>'}, {'', '<p>Ces sujets sont certainement à la mode. Mais en me basant sur mon travail quotidien d’aide aux entreprises pour planifier et exécuter des stratégies DevOps, je remarque un ensemble différent de tendances marquantes dans DevOps. Bien que l’on parle beaucoup de l’impact que des technologies comme l’IA pourraient avoir sur DevOps, les plus grands changements que je constate actuellement concernent d’autres types de solutions et de techniques.</p>'}, {'', '<p>Voici ce que je considère comme les trois tendances DevOps actuelles les plus importantes, ainsi qu’une analyse de la manière dont elles peuvent modifier les outils et les processus DevOps.</p>'}, {'', ""<h3>La gestion basée sur les politiques et l'IaC stimulent l'innovation en matière de sécurité DevOps</h3>""}, {'', '<p>La sécurité a toujours été une priorité pour les praticiens DevOps. Mais aujourd’hui, je vois les équipes DevOps adopter de nouvelles stratégies pour améliorer la sécurité des applications et des environnements qu’elles prennent en charge.</p>'}, {'', '<p>L’un des changements majeurs est l’utilisation accrue de la gestion des politiques basée sur le cloud pour appliquer les meilleures pratiques de sécurité dans les environnements cloud. Les équipes configurent les services et les ressources cloud à l’aide des cadres de configuration basés sur le code pris en charge par les fournisseurs de cloud, puis analysent les configurations pour détecter les risques.</p>'}, {'', ""<p>Cette approche permet d'appliquer la gouvernance du cloud de manière cohérente, centralisée et automatique. Au lieu de simplement rédiger des politiques de gouvernance et d'espérer que les ingénieurs se souviendront de les suivre lorsqu'ils configureront les ressources cloud, les entreprises créent des garde-fous de gouvernance automatisés via une gestion basée sur des politiques.</p>""}, {'', '<p>Dans la même veine, de plus en plus d’équipes DevOps avec lesquelles je travaille adoptent l’analyse statique du code des modèles d’infrastructure en tant que code (IaC) comme moyen de détecter les risques. Comme pour la gestion des ressources cloud basée sur des politiques, une approche centrée sur l’IaC pour le provisionnement de l’infrastructure permet d’automatiser la gestion de l’infrastructure et d’identifier les risques de sécurité plus tôt dans le cycle de vie du développement.</p>'}, {'', ""<p>Certaines équipes utilisent la stratégie cloud et l'analyse du code IaC pour s'avertir mutuellement des changements de stratégie de sécurité susceptibles de provoquer la défaillance d'une application ou d'un service. Pour ce faire, elles insèrent des modifications de configuration dans leur code à l'aide du mode « audit » si leur infrastructure de configuration le prend en charge, ou en configurant des scanners IaC pour signaler les modifications si une fonction d'audit n'est pas disponible. Cela permet aux ingénieurs de détecter si une modification peut entraîner un problème pour un déploiement existant.</p>""}, {'', '<p>C’est un point important, car les équipes de sécurité et d’applications fonctionnent séparément dans de nombreuses organisations. Lorsque les deux groupes ne disposent pas d’un moyen efficace de communiquer sur les changements, ils peuvent perturber leurs opérations respectives : c’est le problème de la « main droite/main gauche ». L’analyse de la configuration permet de s’assurer systématiquement que chaque groupe est sur la même longueur d’onde lorsqu’il est temps d’introduire des changements. De plus, l’approche en mode « audit » offre une période de grâce qui permet de réagir avant qu’un changement ne prenne effet.</p>'}, {""<h3>Doubler l'automatisation DevOps avec GitOps</h3>"", ''}, {'', '<p>Une autre tendance générale qui remodèle actuellement DevOps est l’utilisation de GitOps pour rendre l’automatisation DevOps plus efficace et cohérente.</p>'}, {'', ""<p>GitOps est l'utilisation de Git (ou d'un système de contrôle de source similaire) pour gérer les workflows DevOps automatisés. Il s'agit de définir des configurations à l'aide de code et de les appliquer via des fonctionnalités telles que les actions GitHub.</p>""}, {'', ""<p>Lorsque vous optez pour GitOps, vous déplacez les contrôles d'automatisation DevOps des postes de travail individuels vers des référentiels de contrôle de source centralisés. Le résultat est la possibilité de suivre et de gérer tous les flux de travail automatisés via un hub central. Cela augmente l'efficacité et atténue les problèmes tels que les différents ingénieurs travaillant avec différentes versions des mêmes cadres d'automatisation sur leurs postes de travail personnels.</p>""}, {'', '<p>De plus, GitOps génère automatiquement des enregistrements de ce qui a changé et de la manière dont cela a changé, car chaque action est enregistrée via le système de contrôle de source. Il ne s’agit pas exactement d’une documentation au sens traditionnel du terme, ce qui signifie que GitOps documente de manière exhaustive chaque changement, ce qui est bénéfique car les ingénieurs humains ont tendance à ne pas être aussi minutieux lorsqu’ils documentent leurs actions.</p>'}, {'', '<p>Certes, GitOps n’est pas sans défis. La mise en œuvre efficace de GitOps nécessite des compétences supplémentaires, notamment une expertise des frameworks IaC et des systèmes de contrôle de source, que tous les ingénieurs DevOps ne possèdent pas. Je remarque également une tendance de la part de certaines équipes à mettre en place des pipelines GitOps, mais à s’appuyer sur des approbations manuelles au lieu d’actions automatisées pour déclencher les changements. Cette approche réduit considérablement la valeur de l’automatisation des pipelines en premier lieu.</p>'}, {'', '<p>Cependant, ces défis peuvent être résolus par les équipes grâce à la formation et en s’appuyant pleinement sur GitOps. En outre, des techniques telles que les tests automatisés du code de configuration GitOps peuvent contribuer à renforcer la confiance des équipes dans les automatisations et à réduire la dépendance aux approbations manuelles.</p>'}, {'', '<p>À l’avenir, on peut s’attendre à ce que les équipes qui cherchent à améliorer leur approche de l’automatisation DevOps adoptent de plus en plus les techniques GitOps. L’automatisation des processus DevOps individuels (tels que les tests et le déploiement de logiciels) ne suffira pas. Les organisations véritablement efficaces se tourneront vers GitOps pour automatiser l’intégralité de leurs flux de travail DevOps, de bout en bout.</p>'}, {'<h3>Investir dans l’expérience des développeurs</h3>', ''}, {'', '<p>Rendre les processus de livraison de logiciels plus prévisibles et plus efficaces n’est qu’une étape vers l’objectif ultime de DevOps, qui est d’aider les développeurs à devenir productifs et satisfaits de leur travail.</p>'}, {'', '<p>À cet égard, je constate actuellement un intérêt et un investissement dans l’expérience des développeurs. Cela se traduit par deux initiatives interdépendantes.</p>'}, {'', '<p>L’une des initiatives est l’ingénierie de plateforme. Elle consiste à créer des équipes DevOps spécialisées dans certaines fonctions, telles que la gestion du réseau ou la sécurité. Ces équipes sont désignées pour prendre en charge ces fonctions dans toute l’organisation. Cette approche réduit la charge cognitive des développeurs en les libérant de la nécessité de gérer des types de travail en dehors de leur domaine d’activité principal. En d’autres termes, au lieu de forcer les développeurs à être des généralistes DevOps, l’ingénierie de plateforme permet aux différentes équipes de se concentrer sur ce qu’elles connaissent et apprécient le plus, ce qui conduit à une plus grande productivité et à des niveaux de satisfaction au travail plus élevés.</p>'}, {'', '<p>L’autre grande tendance actuelle en matière d’expérience des développeurs est le libre-service. Cela signifie que les développeurs peuvent obtenir les solutions techniques dont ils ont besoin à la demande sans passer par un processus d’approvisionnement compliqué. Dans la plupart des cas, les organisations permettent le libre-service en mettant en œuvre des plateformes de développement internes (parfois appelées portails internes pour développeurs) (IDP) qui hébergent des ressources d’infrastructure et des environnements logiciels prêts à l’emploi que les développeurs peuvent déployer en libre-service.</p>'}, {'', '<p>Ces tendances comportent des risques inhérents. Elles nécessitent des compétences spécialisées. Lorsqu’elles sont mal mises en œuvre, les solutions d’ingénierie de plateforme et de PDI peuvent créer plus de problèmes qu’elles n’en résolvent. Cependant, si vous vous assurez que vos équipes disposent de l’expertise requise et que vous déployez un PDI soigneusement planifié qui donne aux développeurs l’accès aux ressources dont ils ont besoin, vous constaterez probablement une réduction significative des frictions au sein de votre organisation et une augmentation de la productivité et du bonheur des développeurs.</p>'}, {'', '<h3>Des changements dans le monde réel, au-delà du cycle du battage médiatique</h3>'}, {'', '<p>Certes, discuter des tendances DevOps axées sur la sécurité, l’automatisation et l’expérience des développeurs n’est peut-être pas aussi passionnant que de débattre de la question de savoir si l’IA va supprimer les emplois des ingénieurs DevOps. Mais si vous voulez savoir ce qui change réellement dans le monde de DevOps – par opposition aux discussions qui suscitent le plus d’intérêt – c’est là qu’il faut chercher.</p>'}, {'', '<p>La sécurité, l’automatisation et l’expérience des développeurs font également partie des domaines de DevOps où il existe de nombreuses opportunités d’innovation – et, en effet, où l’adoption de nouveaux outils et techniques sera essentielle pour les organisations qui ne veulent pas être laissées pour compte à mesure que DevOps évolue.</p>'}]"
Une enquête sur Harness révèle une série de défis DevOps,"[{'', ""<p>Une enquête menée auprès de 500 responsables de l'ingénierie logicielle (38 %) et de praticiens révèle que près de la moitié d'entre eux déclarent qu'ils ne peuvent pas publier de code en production sans risquer des échecs, et 39 % d'entre eux indiquent que leur code ne parvient pas à être mis en production au moins la moitié du temps.</p>""}, {'', ""<p>Réalisée par Wakefield Research pour le compte de Harness, un fournisseur d'une plateforme d'intégration continue/livraison continue (CI/CD), l'enquête révèle également que lorsque le code doit être restauré, plus des deux tiers ont recours à des processus manuels.</p>""}, {'', '<p>Dans l’ensemble, 60 % des répondants ont également indiqué qu’ils continuaient à publier du code sur une base mensuelle ou trimestrielle. 59 % des développeurs ont déclaré que les exigences de sécurité des applications limitaient leur capacité à publier du code fréquemment.</p>'}, {'', ""<p>Nick Durkin, directeur technique de terrain chez Harness, a déclaré que l'une des principales raisons pour lesquelles la sécurité reste un goulot d'étranglement est principalement due au fait qu'une trop grande partie de la responsabilité en la matière a été transférée aux développeurs, au lieu de s'appuyer sur des plateformes DevSecOps imprégnées d'intelligence artificielle (IA) pour identifier et résoudre automatiquement les problèmes d'une manière qui responsabilise toutes les personnes impliquées dans le développement de logiciels.</p>""}, {'', '<p>En général, l’IA devrait être utilisée pour éliminer des tâches fastidieuses telles que la création et l’exécution de tests dans le cadre d’un effort plus vaste visant à éliminer le besoin de surveiller les outils et les plateformes, a ajouté Durkin.</p>'}, {'', '<p>Par exemple, 42 % des professionnels interrogés ont déclaré que le déploiement du code n’était ni rapide ni efficace, et 44 % ont indiqué que tester le code de bout en bout n’était pas efficace. Plus des deux tiers (67 %) ont déclaré qu’ils devaient attendre une semaine pour tester complètement le code et, même dans ce cas, 32 % ont déclaré que la couverture des tests unitaires n’était pas élevée.</p>'}, {'', '<p>Plus de la moitié (52 %) des développeurs interrogés ont attribué l’épuisement professionnel à l’une des principales raisons pour lesquelles leurs collègues ont quitté leur emploi, et un peu moins d’un quart (23 %) d’entre eux ont fait des heures supplémentaires au moins 10 jours par mois. 97 % d’entre eux ont déclaré qu’ils changeaient régulièrement de contexte entre 14 outils différents en moyenne.</p>'}, {'', '<p>Plus de la moitié (54 %) des personnes interrogées ont indiqué qu’il leur fallait plus d’une semaine pour apprendre à utiliser un nouvel outil. 59 % ont déclaré qu’il leur fallait une semaine pour créer un outillage interne. Plus d’un quart (28 %) ont déclaré qu’il leur fallait une journée pour créer un artefact.</p>'}, {'', ""<p>Près des deux tiers (62 %) des développeurs ont également connu une dérive du périmètre à mesure que les exigences s'élargissent, ce qui les rend moins confiants dans leur capacité à exécuter.</p>""}, {'', ""<h3>Un rapport révèle que l'intégration des nouveaux employés prend trop de temps</h3>""}, {'', '<p>Les nouvelles recrues ne semblent pas non plus apporter de soulagement immédiat, car leur intégration prend en moyenne 100 jours, selon 71 % des répondants.</p>'}, {'', '<p>De plus, 40 % des développeurs ont déclaré que leur organisation n’appliquait pas de bonnes politiques de sécurité et de gouvernance. Au total, 41 % d’entre eux n’ont pas de politiques de sécurité et de gouvernance automatisées, tandis que 42 % ont déclaré ne pas disposer de politiques de gestion des identités et des accès solides.</p>'}, {'', '<p>62 % des dirigeants interrogés ont déclaré qu’ils préféreraient résoudre ces problèmes en adoptant une plateforme DevOps intégrée, mais le rythme auquel cette transition se produit n’est pas clair. De nombreuses organisations ont investi massivement dans des plateformes DevOps existantes qu’elles sont souvent réticentes à abandonner et à remplacer. Dans de nombreux cas, les organisations effectuent la transition vers une plateforme DevOps moderne pour les nouveaux projets de développement d’applications tout en continuant à utiliser des plateformes existantes pour mettre à jour les applications existantes.</p>'}, {'', '<p>Rares sont ceux qui contesteraient que les flux de travail de développement logiciel sont optimaux. Le défi consiste à déterminer la meilleure façon d’avancer par rapport à la situation actuelle de la plupart des organisations, de manière à minimiser autant que possible les perturbations à un moment où les organisations n’ont jamais été aussi dépendantes des logiciels.</p>'}]"
Le cadeau qui continue à donner,[{''}]
Est-ce que plus d’argent améliore la sécurité de l’open source ?,"[{'', '<p>Cela paraît simple : si vous payez plus d’argent aux développeurs, ils amélioreront la qualité de leur code, n’est-ce pas ? Les preuves ne sont pas aussi claires.</p>'}, {'', '<p>Jusqu’à présent, il n’existait que peu de preuves directes démontrant que le fait de rémunérer les développeurs open source permettait d’obtenir un code plus sûr. Le Digital Forensic Research Lab (DFRLab) de l’Atlantic Council a récemment montré une corrélation entre le financement des mainteneurs et la sécurité du code open source.</p>'}, {'', '<p>Plus précisément, les chercheurs ont trouvé « des preuves prima facie d’un effet positif du financement général des logiciels open source sur la sécurité des logiciels open source ». Ils ont examiné les 1 000 packages Python Package Index (PyPl) et npm JavaScript les plus téléchargés. En utilisant les outils de l’Open Source Security Foundation (OpenSSF) tels que « funder-finder » et « Security Scorecard », les chercheurs ont constaté un lien entre le soutien financier et les améliorations de sécurité.</p>'}, {'', '<p>Cela peut sembler une conclusion évidente, mais les preuves ne sont pas aussi claires qu’on pourrait le penser. Les chercheurs rapportent avec une « confiance modérée » qu’il existe un lien significatif « entre un financement accru des projets open source et une meilleure posture de sécurité. […] [L]’augmentation du financement est généralement corrélée à des pratiques de sécurité plus différenciées. »</p>'}, {'', '<p>Cela semble aller à l’encontre du bon sens. Comme l’a dit Dana Wang, architecte en chef d’OpenSSF, « trouver un équilibre entre la sécurité, la fiabilité, la disponibilité, les performances et le coût des logiciels open source n’est pas une mince affaire. Les mainteneurs doivent parfois choisir entre de nouvelles fonctionnalités, des corrections de bugs et des correctifs de sécurité moins critiques. » Et, même après des fiascos de sécurité de projets open source tels que Log4J, comme nous le savons tous, la sécurité arrive trop souvent en bas de la liste des priorités des développeurs.</p>'}, {'', '<p>D’autres recherches, comme le rapport 2023 State of the Open Source Maintainer Report de la société de sécurité de programmation Tidelift, ont montré que « les mainteneurs rémunérés étaient 25 à 30 % plus susceptibles d’avoir terminé le travail ou le plan [de sécurité] par rapport aux mainteneurs non rémunérés. Pour chaque pratique de développement étudiée, les mainteneurs rémunérés étaient nettement plus susceptibles de la mettre en œuvre que les mainteneurs non rémunérés. »</p>'}, {'', '<p>Parfois, des correctifs de sécurité sont nécessaires et disponibles, mais les entreprises ne les adoptent pas. Dans une autre étude de Synopsys, le rapport 2024 Open Source Security and Risk Analysis, moins de la moitié des bases de code contenaient des composants open source sans nouveau développement au cours des deux dernières années ; 91 % contenaient des composants dix versions ou plus en retard par rapport à la dernière version. Il s’agit d’un échec des utilisateurs de l’open source, pas des développeurs open source sous-payés. De mauvaises entreprises ! Mauvaises !</p>'}, {'', '<p>En revenant à l’étude du DFRLab, les chercheurs ont également constaté que la diversité des sources de financement semblait être bénéfique. En d’autres termes, les projets bénéficiant de plusieurs soutiens semblent mieux réussir (au moins en termes de sécurité) que ceux bénéficiant d’un seul soutien. Cela suggère que les investisseurs devraient envisager une variété de mécanismes de soutien plutôt qu’un financement par une seule source.</p>'}, {'', '<p>L’une des raisons pour lesquelles les résultats sont si flous est que nous n’avons pas assez de données. Comme l’a observé l’équipe du DFRLab, « l’outil OpenSSF Scorecard lui-même présente plusieurs particularités… Le scorecard ne capture pas nécessairement toutes les améliorations de sécurité qui peuvent survenir au cours d’un projet. Par exemple, un audit de sécurité, payé volontairement par les mainteneurs qui ont reçu un financement, peut rechercher et corriger de nouvelles vulnérabilités sans probablement améliorer directement aucune mesure du scorecard. Certaines pratiques peuvent également répondre en principe aux critères d’OpenSSF mais ne pas être prises en compte par la vérification automatisée du scorecard. Par exemple, un projet peut inclure une politique de sécurité solide mais avec un nom de fichier différent de celui recherché par la recherche du scorecard, et donc ne pas passer le sous-contrôle. »</p>'}, {'', '<p>Comme le souligne DFRLab, nous devons mener davantage de recherches pour comprendre l’impact du financement sur la sécurité. Personne ne peut vraiment douter que davantage d’argent aide, mais la manière la plus efficace de financer les projets, les mainteneurs et les développeurs – et la façon dont nous devrions mesurer les résultats – restent floues.</p>'}, {'', '<p>Étant donné l’importance de la sécurité open source pour l’ensemble de nos technologies, plus tôt nous la découvrirons, mieux ce sera.</p>'}, {''}, {'', '<p>Crédit photo : Jonathan Kemper sur Unsplash</p>'}]"
Le but de la vie,[{''}]
Cinq excellentes opportunités d'emploi DevOps,"[{'', '<p>DevOps.com fournit un rapport hebdomadaire sur les emplois DevOps à travers lequel les opportunités pour les professionnels DevOps sont mises en évidence pour mieux servir notre public.</p>'}, {'', '<p>En ces temps économiques difficiles, notre objectif est de faciliter l’évolution professionnelle des professionnels DevOps. Bien entendu, le vivier de talents DevOps disponibles est encore relativement restreint. Ainsi, lorsqu’un professionnel DevOps assume un nouveau rôle, cela a tendance à créer une opportunité pour les autres. Nous nous engageons également à fournir des informations supplémentaires sur l’état du marché de l’emploi DevOps.</p>'}, {'', '<p>Ces cinq offres d’emploi sont sélectionnées en fonction de l’entreprise qui recrute, du segment industriel vertical et, bien entendu, de l’échelle salariale proposée.</p>'}, {'', '<p>En attendant, pour votre considération.</p>'}, {'', '<p>Scientific American de Springer Nature GroupNew York/Washington D.C.Directeur de DevOps170 000 à 210 000 dollars</p>'}, {'', '<p>CareerBuilder.com</p>'}, {'', '<p>HRL LaboratoriesMalibu, CAIngénieur DevOps senior145\xa0745 $ à 186\xa0688 $</p>'}, {'', '<p>Indeed.com</p>'}, {'', '<p>CAST.ERAArlington, VADevOps Engineer130 000 $ à 150 000 $</p>'}, {'', '<p>Dés.com</p>'}, {'', '<p>Ingénieur DevOps principal VetsEZRemote100\xa0000 à 125\xa0000\xa0USD</p>'}, {'', '<p>LinkedIn</p>'}, {'', '<p>GE DigitalRemoteIngénieur DevOps senior96\xa0000 à 144\xa0000\xa0USD</p>'}, {'', '<p>Photo de Scott Graham sur Unsplash</p>'}]"
Payer vos cotisations,[{''}]
Cinq excellentes opportunités d'emploi DevOps,"[{'', ""<p>DevOps.com fournit un rapport hebdomadaire sur les emplois DevOps à travers lequel les opportunités pour les professionnels DevOps sont mises en évidence dans le cadre d'un effort visant à mieux servir notre public.</p>""}, {'', ""<p>Notre objectif en cette période économique difficile est de permettre aux professionnels DevOps de faire progresser leur carrière plus facilement. Bien entendu, le vivier de talents DevOps disponibles est encore relativement limité. Ainsi, lorsqu'un professionnel DevOps assume un nouveau rôle, cela a tendance à créer une opportunité pour les autres.</p>""}, {'', '<p>Les cinq offres d’emploi partagées cette semaine sont sélectionnées en fonction de l’entreprise qui cherche à embaucher, du segment industriel vertical et, bien entendu, de l’échelle salariale proposée.</p>'}, {'', '<p>Nous nous engageons également à fournir des informations supplémentaires sur l’état du marché du travail DevOps. En attendant, à votre attention.</p>'}, {'', '<p>LinkedIn</p>'}, {'', ""<p>VisaDirecteur principal de l'ingénierie DevOpsBellevue, WA173\xa0400 à 271\xa0000 $</p>""}, {'', '<p>SimplyHired.com</p>'}, {'', '<p>Publicis SapientDallasArchitecte DevOps – Kubernetes140 000 $ à 180 000 $</p>'}, {'', '<p>Indeed.com</p>'}, {'', '<p>UBSNew York CityIngénieur logiciel – DevOps135\xa0000 $ à 165\xa0000 $</p>'}, {'', '<p>Dés.com</p>'}, {'', '<p>NBC UniversalEnglewood, NJResponsable de la surveillance et du contrôle DevOps130\xa0000 à 170\xa0000\xa0USD</p>'}, {'', '<p>CareerBuilder.com</p>'}, {'', ""<p>BAE SystemsNashua, NHAdministrateur des outils d'ingénierie logicielle DevOps112\xa0142 $ à 191\xa0070 $</p>""}]"
